{
  "$schema": "https://json-schema.org/draft/2020-12/schema",
  "$id": "https://github.com/aetiusgular/tk/contracts/policy.schema.json",
  "title": "tk policy file (~/.tk/policy.json)",
  "description": "Contract: contracts/policy.md",
  "type": "object",
  "additionalProperties": false,
  "required": ["version"],
  "properties": {
    "version": { "const": 1 },
    "askTimeoutSeconds": { "type": "integer", "minimum": 1, "maximum": 3600, "default": 60 },
    "servers": {
      "type": "array",
      "items": { "type": "string", "pattern": "^[A-Za-z0-9][A-Za-z0-9._-]{0,99}$" },
      "uniqueItems": true
    },
    "rules": {
      "type": "array",
      "maxItems": 1000,
      "items": {
        "type": "object",
        "additionalProperties": false,
        "required": ["tool", "action"],
        "properties": {
          "tool": {
            "type": "string",
            "pattern": "^(\\*|[a-z0-9_]+/(\\*|[a-z0-9_]+)|[a-z0-9_]+)$"
          },
          "harness": { "type": "string", "pattern": "^[a-z0-9][a-z0-9-]{0,63}$" },
          "chat": { "type": "string", "minLength": 1, "maxLength": 200 },
          "action": { "enum": ["allow", "ask", "deny"] },
          "descriptionSha256": { "type": "string", "pattern": "^[0-9a-f]{64}$" }
        }
      }
    }
  }
}
